{
  "$schema": "https://json-schema.org/draft/2020-12/schema",
  "$id": "https://ucp.dev/schemas/shopping/types/product.json",
  "title": "Product",
  "description": "A product in the catalog with variants and options.",
  "type": "object",
  "$defs": {
    "range_eligible_variant": {
      "description": "A variant with a price whose well-known pricing mode makes it usable for this caller.",
      "required": ["price"],
      "anyOf": [
        { "not": { "required": ["pricing"] } },
        {
          "properties": {
            "pricing": {
              "properties": {
                "mode": { "enum": ["public", "buyer_specific"] }
              },
              "required": ["mode"]
            }
          },
          "required": ["pricing"]
        }
      ]
    }
  },
  "required": [
    "id",
    "title",
    "description",
    "variants"
  ],
  "properties": {
    "id": {
      "type": "string",
      "description": "Global ID (GID) uniquely identifying this product."
    },
    "handle": {
      "type": "string",
      "description": "URL-safe slug for SEO-friendly URLs (e.g., 'blue-runner-pro'). Use id for stable API references."
    },
    "title": {
      "type": "string",
      "description": "Product title."
    },
    "description": {
      "$ref": "../../common/types/description.json",
      "description": "Product description in one or more formats."
    },
    "url": {
      "type": "string",
      "format": "uri",
      "description": "Canonical product page URL."
    },
    "categories": {
      "type": "array",
      "items": {
        "$ref": "category.json"
      },
      "description": "Product categories with optional taxonomy identifiers."
    },
    "price_range": {
      "$ref": "../../common/types/price_range.json",
      "description": "Price range across range-eligible variants. [PROPOSED: a range-eligible variant has a numeric `price` and either no `pricing` object, `pricing.mode: public`, or `pricing.mode: buyer_specific`. A variant with an unknown mode is not range-eligible even if it carries a numeric price. `price_range` is REQUIRED when every variant is range-eligible, MAY be omitted when the product mixes eligible and ineligible variants, and MUST be omitted when no variant is eligible. When present, it MUST be computed only over eligible variants and MUST NOT zero-fill or synthesize prices. A range derived from `buyer_specific` prices is caller-specific and MUST be isolated from other callers. `list_price_range` follows the same omission rule when no range-eligible variant exists.]"
    },
    "list_price_range": {
      "$ref": "../../common/types/price_range.json",
      "description": "List price range before discounts (for strikethrough display)."
    },
    "media": {
      "type": "array",
      "items": {
        "$ref": "../../common/types/media.json"
      },
      "description": "Product media (images, videos, 3D models). First item is the featured media for listings."
    },
    "options": {
      "type": "array",
      "items": {
        "$ref": "product_option.json"
      },
      "description": "Product options (Size, Color, etc.)."
    },
    "variants": {
      "type": "array",
      "items": {
        "$ref": "variant.json"
      },
      "minItems": 1,
      "description": "Purchasable variants of this product. First item is the featured variant for listings."
    },
    "rating": {
      "$ref": "rating.json",
      "description": "Aggregate product rating."
    },
    "tags": {
      "type": "array",
      "items": {
        "type": "string"
      },
      "description": "Product tags for categorization and search."
    },
    "metadata": {
      "type": "object",
      "description": "Business-defined custom data extending the standard product model."
    }
  },
  "allOf": [
    {
      "description": "[PROPOSED] `price_range` is REQUIRED when every variant has a range-eligible price.",
      "if": {
        "properties": {
          "variants": {
            "type": "array",
            "items": { "$ref": "#/$defs/range_eligible_variant" }
          }
        },
        "required": ["variants"]
      },
      "then": { "required": ["price_range"] }
    },
    {
      "description": "[PROPOSED] Range fields MUST be omitted when no variant has a range-eligible price.",
      "if": {
        "properties": {
          "variants": {
            "type": "array",
            "not": {
              "contains": { "$ref": "#/$defs/range_eligible_variant" }
            }
          }
        },
        "required": ["variants"]
      },
      "then": {
        "not": {
          "anyOf": [
            { "required": ["price_range"] },
            { "required": ["list_price_range"] }
          ]
        }
      }
    }
  ]
}
