{"id":"prod_all_quoted","title":"Quoted Line","description":{"plain":"All variants quoted; range must be omitted."},"variants":[{"id":"var_industrial","title":"Industrial","description":{"plain":"Quoted terms."},"pricing":{"mode":"quote_required"}},{"id":"var_wideformat","title":"Wide format","description":{"plain":"Quoted terms."},"pricing":{"mode":"quote_required"}}],"list_price_range":{"min":{"amount":100000,"currency":"USD"},"max":{"amount":200000,"currency":"USD"}}}
