{"description":{"plain":"Mixed product where one variant carries a numeric price alongside an unrecognized pricing mode. The shape is schema-valid for forward compatibility, but an unaware Platform MUST NOT treat that variant's price as range-eligible or safely comparable -- the safest old-consumer behavior is to suppress/recompute the range from variants it understands rather than assume this range is already safe to display."},"id":"prod_unknown_mode_mixed","title":"Mixed Unknown-Mode Line","variants":[{"description":{"plain":"Ordinary public price."},"id":"var_known","price":{"amount":10000,"currency":"USD"},"title":"Known Variant"},{"description":{"plain":"Forward-looking mode this Platform may not understand, carrying a numeric price."},"id":"var_future","price":{"amount":10500,"currency":"USD"},"pricing":{"mode":"future_special_mode"},"title":"Future Mode Variant"}],"price_range":{"max":{"amount":10500,"currency":"USD"},"min":{"amount":10000,"currency":"USD"}}}
