{"description":{"plain":"Identified-buyer product with buyer_specific priced variants producing a caller-specific price_range (A=$80, B=$110 -> range $80-$110). This range is subject to the SAME cache-isolation requirement as the underlying buyer-specific prices: a Platform MUST NOT expose or reuse this price_range for a different caller."},"id":"prod_buyer_specific_range","title":"Linked Buyer Bundle","variants":[{"description":{"plain":"Variant A, resolved for this buyer."},"id":"var_bundle_a","price":{"amount":8000,"currency":"USD"},"pricing":{"mode":"buyer_specific"},"title":"Bundle Part A"},{"description":{"plain":"Variant B, resolved for this buyer."},"id":"var_bundle_b","price":{"amount":11000,"currency":"USD"},"pricing":{"mode":"buyer_specific"},"title":"Bundle Part B"}],"price_range":{"max":{"amount":11000,"currency":"USD"},"min":{"amount":8000,"currency":"USD"}}}
