{"description":{"plain":"Scenario A (point 5): anonymous caller sees an ordinary public catalog price; no special mode needed."},"id":"prod_scenario_a_anon","title":"Industrial Fastener Kit","variants":[{"description":{"plain":"Anonymous caller sees the public catalog price."},"id":"var_fastener_kit","price":{"amount":8900,"currency":"USD"},"title":"Fastener Kit"}],"price_range":{"max":{"amount":8900,"currency":"USD"},"min":{"amount":8900,"currency":"USD"}}}
