{"description":{"plain":"Scenario B, resolved (RESOLVED 2026-10-05, no longer an open question): once the buyer is identified and resolved, the representation transitions contract_only -> buyer_specific + price. This is the selected working design: contract_only remains a genuinely unpriced state describing the caller who has not established entitlement; the Business resolves pricing for the recognized buyer via buyer_specific + price."},"id":"prod_scenario_b_resolved","title":"Enterprise Security Suite","variants":[{"description":{"plain":"Entitled buyer sees their contract price; mode transitions to buyer_specific."},"id":"var_sec_suite","price":{"amount":62500,"currency":"USD"},"pricing":{"mode":"buyer_specific"},"title":"Security Suite"}],"price_range":{"max":{"amount":62500,"currency":"USD"},"min":{"amount":62500,"currency":"USD"}}}
