{"description":{"plain":"Scenario B, anonymous (RESOLVED 2026-10-05): no anonymous price exists; anonymous caller sees contract_only with no price (a genuinely unpriced state, per the resolved caller-state transition: stranger with gated price -> contract_only). price_range MUST be omitted since no variant carries a price."},"id":"prod_scenario_b_anon","title":"Enterprise Security Suite","variants":[{"description":{"plain":"Anonymous caller: no public price exists for this item."},"id":"var_sec_suite","pricing":{"mode":"contract_only"},"title":"Security Suite"}]}
