{"description":{"plain":"Mixed product with a present price_range computed ONLY over priced variants (A=$100, B=quote_required no price, C=$150) -> range is $100-$150, never zero-filled for the unpriced variant."},"id":"prod_mixed_withrange","title":"Mixed Priced Line","variants":[{"description":{"plain":"Variant A, publicly priced."},"id":"var_a","price":{"amount":10000,"currency":"USD"},"title":"Variant A"},{"description":{"plain":"Variant B, quote required, no price."},"id":"var_b","pricing":{"mode":"quote_required"},"title":"Variant B"},{"description":{"plain":"Variant C, publicly priced."},"id":"var_c","price":{"amount":15000,"currency":"USD"},"title":"Variant C"}],"price_range":{"max":{"amount":15000,"currency":"USD"},"min":{"amount":10000,"currency":"USD"}}}
