{"id":"prod_printer_line","title":"Printer Line","description":{"plain":"Mixed priced/quoted line with list range."},"variants":[{"id":"var_desktop","title":"Desktop","description":{"plain":"Publicly priced."},"price":{"amount":29900,"currency":"USD"},"list_price":{"amount":34900,"currency":"USD"}},{"id":"var_industrial","title":"Industrial","description":{"plain":"Quoted terms."},"pricing":{"mode":"quote_required"}}],"list_price_range":{"min":{"amount":34900,"currency":"USD"},"max":{"amount":34900,"currency":"USD"}},"price_range":{"min":{"amount":29900,"currency":"USD"},"max":{"amount":29900,"currency":"USD"}}}
