{"description":{"plain":"Scenario A (point 5): once identified, the buyer's negotiated price is represented as buyer_specific + price. Same variant as the anonymous-state fixture, resolved for a recognized buyer."},"id":"prod_scenario_a_resolved","title":"Industrial Fastener Kit","variants":[{"description":{"plain":"Recognized buyer sees their negotiated price; mode retained as buyer_specific."},"id":"var_fastener_kit","price":{"amount":7600,"currency":"USD"},"pricing":{"mode":"buyer_specific"},"title":"Fastener Kit"}],"price_range":{"max":{"amount":7600,"currency":"USD"},"min":{"amount":7600,"currency":"USD"}}}
