{"description":{"plain":"All variants quoted; no range possible."},"id":"prod_all_quoted","title":"Quoted Line","variants":[{"description":{"plain":"Industrial printer, quoted terms."},"id":"var_industrial","pricing":{"mode":"quote_required"},"title":"Industrial"},{"description":{"plain":"Wide-format printer, quoted terms."},"id":"var_wideformat","pricing":{"mode":"quote_required"},"title":"Wide format"}]}
