{"description":{"plain":"Printer line with one quoted variant."},"id":"prod_printer_line","title":"Printer Line","variants":[{"description":{"plain":"Desktop printer, publicly priced."},"id":"var_desktop","price":{"amount":29900,"currency":"USD"},"title":"Desktop"},{"description":{"plain":"Industrial printer, quoted terms."},"id":"var_industrial","pricing":{"mode":"quote_required"},"title":"Industrial"}]}
